{
  "$schema": "./_schema.json",
  "area": "auth",
  "mode": "anonymous",
  "authoredAgainst": "76b6cf154ab2",
  "description": "인증 화면 영역(로그아웃 모드 --anonymous). 설계서 4-2절. 매핑의 needs-state · needs-seed 가운데 이 영역 몫은 ResetPasswordNewPage 하나다. 통합 앵커에서 이 화면은 app/(auth-brand)/ 로 옮겨져 측정기의 파일 확인(apps/web/app<pattern>/page.tsx)으로는 찾지 못하므로 file 을 적는다.",
  "recipes": [
    {
      "id": "/reset-password/new filled",
      "base": "/reset-password/new",
      "file": "apps/web/app/(auth-brand)/reset-password/new/page.tsx",
      "description": "새 비밀번호 화면의 두 칸(Password · Confirm password)에 값을 넣고 포커스를 푼 상태. 값이 있을 때만 그려지는 표시 토글(eye, aria-label Show password)이 두 칸에 서고, 플로팅 라벨은 떠 있는 쉬는 색(idle)이 된다. Product/Auth Floating Field 의 State=Filled 축의 출처. 매핑 id 는 옛 앵커 경로 apps/web/app/reset-password/new/page.tsx#ResetPasswordNewPage 였다(product.surfaces.json 키도 옛 경로). 통합 앵커 판에는 매핑 blocker 가 말한 지우기(XCircle) 버튼이 없다 — 이 파일의 값 있는 칸에는 토글 하나뿐이다.",
      "contentNote": "지어낸 것은 두 칸의 값뿐이다(같은 자리표시 문자열 Placeholder1 — sanitizePasswordInput 이 남기는 글자만, 두 칸이 같아 오류 문단이 서지 않는다). 비밀번호 칸 값은 측정기가 원장에 싣지 않는다(valueOf 는 password 형을 뺀다). 크기 · 색 · 간격은 측정값이다. 제출하지 않으므로 /api/auth/password/reset/confirm 는 부르지 않는다.",
      "surfaces": [
        "apps/web/app/(auth-brand)/reset-password/new/page.tsx#ResetPasswordNewPage"
      ],
      "cite": [
        { "path": "apps/web/app/(auth-brand)/reset-password/new/page.tsx", "line": 99, "expect": "export default function ResetPasswordNewPage()" },
        { "path": "apps/web/app/(auth-brand)/reset-password/new/page.tsx", "line": 117, "expect": "value.replace(/[^A-Za-z0-9" },
        { "path": "apps/web/app/(auth-brand)/reset-password/new/page.tsx", "line": 198, "expect": "aria-label={messages.auth.signup.passwordLabel}" },
        { "path": "apps/web/app/(auth-brand)/reset-password/new/page.tsx", "line": 200, "expect": "{password ? (" },
        { "path": "apps/web/app/(auth-brand)/reset-password/new/page.tsx", "line": 208, "expect": ": messages.auth.signup.showPassword" },
        { "path": "apps/web/app/(auth-brand)/reset-password/new/page.tsx", "line": 225, "expect": "focused === \"password\" || password" },
        { "path": "apps/web/app/(auth-brand)/reset-password/new/page.tsx", "line": 260, "expect": "aria-label={messages.auth.signup.passwordConfirmLabel}" },
        { "path": "apps/web/app/(auth-brand)/reset-password/new/page.tsx", "line": 262, "expect": "{passwordConfirm ? (" },
        { "path": "apps/web/app/(auth-brand)/reset-password/new/page.tsx", "line": 51, "expect": "inline-flex items-center justify-center" },
        { "path": "apps/web/app/(auth-brand)/reset-password/new/page.tsx", "line": 316, "expect": "idleLabel={t.newPasswordButton}" },
        { "path": "apps/web/components/landing/system/messages/en.ts", "line": 4047, "expect": "passwordLabel: \"Password\"" },
        { "path": "apps/web/components/landing/system/messages/en.ts", "line": 4051, "expect": "passwordConfirmLabel: \"Confirm password\"" },
        { "path": "apps/web/components/landing/system/messages/en.ts", "line": 4068, "expect": "showPassword: \"Show password\"" },
        { "path": "apps/web/components/landing/system/messages/en.ts", "line": 4124, "expect": "newPasswordTitle: \"Set new password\"" },
        { "path": "apps/web/components/landing/system/messages/en.ts", "line": 4126, "expect": "newPasswordButton: \"Save new password\"" }
      ],
      "api": [],
      "steps": [
        { "waitFor": { "label": "Password", "exact": true }, "description": "첫 칸(aria-label Password). exact 가 없으면 Confirm password 도 맞아 엄격 모드로 실패한다." },
        { "fill": { "label": "Password", "exact": true }, "value": "Placeholder1" },
        { "fill": { "label": "Confirm password", "exact": true }, "value": "Placeholder1" },
        { "blur": true, "description": "둘째 칸의 포커스 링(INPUT_BOX_FOCUSED)과 활성 라벨 색을 푼다." },
        { "waitFor": { "role": "button", "name": "Show password", "exact": true, "nth": 0 }, "description": "첫 칸의 표시 토글. 같은 이름 버튼이 둘이라 nth 로 하나씩 본다." },
        { "waitFor": { "role": "button", "name": "Show password", "exact": true, "nth": 1 }, "description": "둘째 칸의 표시 토글." }
      ],
      "pointer": "park",
      "assert": {
        "text": ["Set new password", "Password", "Confirm password", "Save new password"],
        "css": [
          { "selector": "form :is(div, label):has(> input[type=\"password\"]):first-of-type button[type=\"button\"][aria-label=\"Show password\"]", "property": "display", "equals": "inline-flex" }
        ]
      }
    }
  ]
}
